,id,conversation_id,created_at,date,timezone,place,tweet,language,hashtags,cashtags,user_id,user_id_str,username,name,day,hour,link,urls,photos,video,thumbnail,retweet,nlikes,nreplies,nretweets,quote_url,search,near,geo,source,user_rt_id,user_rt,retweet_id,reply_to,retweet_date,translate,trans_src,trans_dest
0,1020064226197377025,1020064226197377025,1532037238000.0,2018-07-19 14:53:58,-0800,,".@PatrickKluivert: “France has a great future. You look at their individual players, most play for @LaLigaEN. But you have diversity and a team that stands for something.”   #WorldCup #LaLigaUSA",en,"['worldcup', 'laligausa']",[],418944537,418944537,AztecaAmeliaaa,Amelia Lopez (Stay Home!),4,14,https://twitter.com/AztecaAmeliaaa/status/1020064226197377025,[],[],0,,False,0,0,0,,worldcup OR worldcup2018,,,,,,,[],,,,
1,1020063580576608256,1020063580576608256,1532037084000.0,2018-07-19 14:51:24,-0800,,"Going into #WorldCup talk, @RayHudson says “This was a memorable World Cup—“  @PatrickKluivert: “Yeah... cause Holland wasn’t in it.”   Media and guests all laugh.   #LaLigaUSA",en,"['worldcup', 'laligausa']",[],418944537,418944537,AztecaAmeliaaa,Amelia Lopez (Stay Home!),4,14,https://twitter.com/AztecaAmeliaaa/status/1020063580576608256,[],[],0,,False,1,0,0,,worldcup OR worldcup2018,,,,,,,[],,,,
2,1018994160219459585,1018994160219459585,1531782114000.0,2018-07-16 16:01:54,-0800,,"Mexico had the 2nd highest mentions on Instagram during the #WorldCup.... the first being the champions themselves, France.   Mexico’s social media game has always been pretty strong though. I remember before the 2014 WC they had the most twitter followers.  https://t.co/EfzRCsxqbq",en,['worldcup'],[],418944537,418944537,AztecaAmeliaaa,Amelia Lopez (Stay Home!),1,16,https://twitter.com/AztecaAmeliaaa/status/1018994160219459585,['https://twitter.com/instagrames/status/1018928308103180288'],[],0,,False,50,0,8,https://twitter.com/instagrames/status/1018928308103180288,worldcup OR worldcup2018,,,,,,,[],,,,
3,1018551654931578880,1018551654931578880,1531676612000.0,2018-07-15 10:43:32,-0800,,Great things happened at Luzhniki.   France won the 2018 #WorldCup there.   And Mexico beat Germany. 😉  Iconic stadium.,en,['worldcup'],[],418944537,418944537,AztecaAmeliaaa,Amelia Lopez (Stay Home!),7,10,https://twitter.com/AztecaAmeliaaa/status/1018551654931578880,[],[],0,,False,22,0,5,,worldcup OR worldcup2018,,,,,,,[],,,,
4,1018549752743383041,1018549752743383041,1531676159000.0,2018-07-15 10:35:59,-0800,,"A kiss is the rain is the best. But nothing like kissing the #WorldCup in the rain, I bet. What a feeling. France. Champions. Enjoy this moment. 🇫🇷",en,['worldcup'],[],418944537,418944537,AztecaAmeliaaa,Amelia Lopez (Stay Home!),7,10,https://twitter.com/AztecaAmeliaaa/status/1018549752743383041,[],[],0,,False,7,0,1,,worldcup OR worldcup2018,,,,,,,[],,,,
5,1018539563340328961,1018539563340328961,1531673730000.0,2018-07-15 09:55:30,-0800,,Nothing more beautiful than that run onto the field to celebrate winning the #WorldCup 😍  Big congratulations to 🇫🇷!,en,['worldcup'],[],418944537,418944537,AztecaAmeliaaa,Amelia Lopez (Stay Home!),7,09,https://twitter.com/AztecaAmeliaaa/status/1018539563340328961,[],[],0,,False,7,0,1,,worldcup OR worldcup2018,,,,,,,[],,,,
6,1018532636422127616,1018532636422127616,1531672078000.0,2018-07-15 09:27:58,-0800,,"Yeup, couldn’t end the 2018 #WorldCup without something like *that* happening.   Lloris with a huge mistake.",en,['worldcup'],[],418944537,418944537,AztecaAmeliaaa,Amelia Lopez (Stay Home!),7,09,https://twitter.com/AztecaAmeliaaa/status/1018532636422127616,[],[],0,,False,5,1,0,,worldcup OR worldcup2018,,,,,,,[],,,,
7,1018532186226475008,1018532186226475008,1531671971000.0,2018-07-15 09:26:11,-0800,,Ratatouille was the best Pixar movie for a long time before Coco was released.   They deserve this. More goals. More goals.   #WorldCup,en,['worldcup'],[],418944537,418944537,AztecaAmeliaaa,Amelia Lopez (Stay Home!),7,09,https://twitter.com/AztecaAmeliaaa/status/1018532186226475008,[],[],0,,False,6,2,1,,worldcup OR worldcup2018,,,,,,,[],,,,
8,1018531761540612097,1018531761540612097,1531671870000.0,2018-07-15 09:24:30,-0800,,MBAPPE!!!!  LET THIS FRANCE TEAM HAVE FUN!!  #WorldCup,en,['worldcup'],[],418944537,418944537,AztecaAmeliaaa,Amelia Lopez (Stay Home!),7,09,https://twitter.com/AztecaAmeliaaa/status/1018531761540612097,[],[],0,,False,1,0,0,,worldcup OR worldcup2018,,,,,,,[],,,,
9,1018523243710332929,1018523243710332929,1531669839000.0,2018-07-15 08:50:39,-0800,,And we still got another half to go. #WorldCup,en,['worldcup'],[],418944537,418944537,AztecaAmeliaaa,Amelia Lopez (Stay Home!),7,08,https://twitter.com/AztecaAmeliaaa/status/1018523243710332929,[],[],0,,False,0,0,0,,worldcup OR worldcup2018,,,,,,,[],,,,
10,1018520874981339136,1018520874981339136,1531669274000.0,2018-07-15 08:41:14,-0800,,"One of the children woke up so I missed him calling the Pk and France scoring. But man, what an exciting game. #WorldCup",en,['worldcup'],[],418944537,418944537,AztecaAmeliaaa,Amelia Lopez (Stay Home!),7,08,https://twitter.com/AztecaAmeliaaa/status/1018520874981339136,[],[],0,,False,2,0,0,,worldcup OR worldcup2018,,,,,,,[],,,,
11,1018517918722580480,1018517918722580480,1531668569000.0,2018-07-15 08:29:29,-0800,,"That all started with a hesitation to challenge that counter in the middle. Also, that’s a strong shot.   We got ourselves a game.   #WorldCup",en,['worldcup'],[],418944537,418944537,AztecaAmeliaaa,Amelia Lopez (Stay Home!),7,08,https://twitter.com/AztecaAmeliaaa/status/1018517918722580480,[],[],0,,False,3,0,1,,worldcup OR worldcup2018,,,,,,,[],,,,
12,1018515432238542848,1018515432238542848,1531667976000.0,2018-07-15 08:19:36,-0800,,Oh man. Own goal still the leading goalscorer this #WorldCup,en,['worldcup'],[],418944537,418944537,AztecaAmeliaaa,Amelia Lopez (Stay Home!),7,08,https://twitter.com/AztecaAmeliaaa/status/1018515432238542848,[],[],0,,False,4,0,0,,worldcup OR worldcup2018,,,,,,,[],,,,
13,1018515080156098564,1018515080156098564,1531667892000.0,2018-07-15 08:18:12,-0800,,I can’t even imagine the level of nerves. That’s a good opportunity here for France. #WorldCup,en,['worldcup'],[],418944537,418944537,AztecaAmeliaaa,Amelia Lopez (Stay Home!),7,08,https://twitter.com/AztecaAmeliaaa/status/1018515080156098564,[],[],0,,False,3,0,0,,worldcup OR worldcup2018,,,,,,,[],,,,
14,1018510652925665286,1018510652925665286,1531666837000.0,2018-07-15 08:00:37,-0800,,Last match for this #WorldCup. It’s been a privilege to share this with all of you. Let’s make it a good one.  https://t.co/j4l9m3a92E,en,['worldcup'],[],418944537,418944537,AztecaAmeliaaa,Amelia Lopez (Stay Home!),7,08,https://twitter.com/AztecaAmeliaaa/status/1018510652925665286,[],['https://pbs.twimg.com/tweet_video_thumb/DiJ6CReUYAAnnIK.jpg'],1,https://pbs.twimg.com/tweet_video_thumb/DiJ6CReUYAAnnIK.jpg,False,6,0,0,,worldcup OR worldcup2018,,,,,,,[],,,,
15,1018271454381535233,1018271454381535233,1531609807000.0,2018-07-14 16:10:07,-0800,,Awesome look inside the Qatar exhibit previewing 2022 from @ecauich before the end of the current #WorldCup  https://t.co/54K13nd9hD,en,['worldcup'],[],418944537,418944537,AztecaAmeliaaa,Amelia Lopez (Stay Home!),6,16,https://twitter.com/AztecaAmeliaaa/status/1018271454381535233,['https://twitter.com/ecauich/status/1017929938010279937'],[],0,,False,0,0,0,https://twitter.com/ecauich/status/1017929938010279937,worldcup OR worldcup2018,,,,,,,[],,,,
16,1017179153282396160,1017179153282396160,1531349383000.0,2018-07-11 15:49:43,-0800,,"The best thing about England getting so far in this #WorldCup is it strengthened my relationship with Rebecca Lowe on IG and now we’re basically best friends.   (Okay, we’re not but she’s a national treasure and responds to me and let me have this).",en,['worldcup'],[],418944537,418944537,AztecaAmeliaaa,Amelia Lopez (Stay Home!),3,15,https://twitter.com/AztecaAmeliaaa/status/1017179153282396160,[],[],0,,False,13,0,0,,worldcup OR worldcup2018,,,,,,,[],,,,
17,1017150851645751296,1017150851645751296,1531342635000.0,2018-07-11 13:57:15,-0800,,"Me going all in with #ENG, getting my hopes up with that great goal to give them the 1-0 lead only to lose the match 2-1. #WorldCup  https://t.co/nIvbJ9pTRA",en,"['eng', 'worldcup']",[],418944537,418944537,AztecaAmeliaaa,Amelia Lopez (Stay Home!),3,13,https://twitter.com/AztecaAmeliaaa/status/1017150851645751296,[],[],1,https://pbs.twimg.com/ext_tw_video_thumb/1017150807995658240/pu/img/_gF2DOHZd6an5OOk.jpg,False,9,0,0,,worldcup OR worldcup2018,,,,,,,[],,,,
18,1017128284738371584,1017128284738371584,1531337255000.0,2018-07-11 12:27:35,-0800,,"Oh, cause it’s the 2018 #WorldCup and anything can happen. That high kick.  https://t.co/IdxZ9Ky44N",en,['worldcup'],[],418944537,418944537,AztecaAmeliaaa,Amelia Lopez (Stay Home!),3,12,https://twitter.com/AztecaAmeliaaa/status/1017128284738371584,['https://twitter.com/aztecaameliaaa/status/1017106019388805123'],[],0,,False,2,0,1,https://twitter.com/aztecaameliaaa/status/1017106019388805123,worldcup OR worldcup2018,,,,,,,[],,,,
19,1016425679536021504,1016425679536021504,1531169740000.0,2018-07-09 13:55:40,-0800,,#MondayMemories: I share a personal video compilation of my time in Russia following 🇲🇽 at the #WorldCup and its signifance to me once I got home:  Link ➡️  https://t.co/pQKNt1V4j2  https://t.co/beWFrBzdVe,en,"['mondaymemories', 'worldcup']",[],418944537,418944537,AztecaAmeliaaa,Amelia Lopez (Stay Home!),1,13,https://twitter.com/AztecaAmeliaaa/status/1016425679536021504,['https://youtu.be/_fd6uOp59KA'],['https://pbs.twimg.com/media/DhsRuVjVAAASyZ1.jpg'],1,https://pbs.twimg.com/media/DhsRuVjVAAASyZ1.jpg,False,76,4,10,,worldcup OR worldcup2018,,,,,,,[],,,,
20,1015696427538771969,1015696427538771969,1530995873000.0,2018-07-07 13:37:53,-0800,,PKs in the #WorldCup PKs in the #WorldCup PKs in the #WorldCup PKs in the #WorldCup  https://t.co/MzGr34IKLz,en,"['worldcup', 'worldcup', 'worldcup', 'worldcup']",[],418944537,418944537,AztecaAmeliaaa,Amelia Lopez (Stay Home!),6,13,https://twitter.com/AztecaAmeliaaa/status/1015696427538771969,[],['https://pbs.twimg.com/tweet_video_thumb/Dhh6gykVQAALXql.jpg'],1,https://pbs.twimg.com/tweet_video_thumb/Dhh6gykVQAALXql.jpg,False,4,0,1,,worldcup OR worldcup2018,,,,,,,[],,,,
21,1015690064444076032,1015690064444076032,1530994356000.0,2018-07-07 13:12:36,-0800,,Do ANY of the defenders marking the post even want to do their job during this #WorldCup?,en,['worldcup'],[],418944537,418944537,AztecaAmeliaaa,Amelia Lopez (Stay Home!),6,13,https://twitter.com/AztecaAmeliaaa/status/1015690064444076032,[],[],0,,False,6,0,0,,worldcup OR worldcup2018,,,,,,,[],,,,
22,1015665289491435521,1015665289491435521,1530988449000.0,2018-07-07 11:34:09,-0800,,"Omg. That's the goal of the tournament, me thinks. What a beauty. #WorldCup",en,['worldcup'],[],418944537,418944537,AztecaAmeliaaa,Amelia Lopez (Stay Home!),6,11,https://twitter.com/AztecaAmeliaaa/status/1015665289491435521,[],[],0,,False,12,1,0,,worldcup OR worldcup2018,,,,,,,[],,,,
23,1013817970634600448,1013817970634600448,1530548014000.0,2018-07-02 09:13:34,-0800,,Two of the three MLS players had good performances in this #WorldCup on this 🇲🇽 squad. One started every match. That’s all I gotta say.,en,['worldcup'],[],418944537,418944537,AztecaAmeliaaa,Amelia Lopez (Stay Home!),1,09,https://twitter.com/AztecaAmeliaaa/status/1013817970634600448,[],[],0,,False,29,2,0,,worldcup OR worldcup2018,,,,,,,[],,,,
24,1013797037844754433,1013797037844754433,1530543023000.0,2018-07-02 07:50:23,-0800,,Also: Vela. #WorldCup,pt,['worldcup'],[],418944537,418944537,AztecaAmeliaaa,Amelia Lopez (Stay Home!),1,07,https://twitter.com/AztecaAmeliaaa/status/1013797037844754433,[],[],0,,False,5,0,1,,worldcup OR worldcup2018,,,,,,,[],,,,
25,1013796768557948929,1013796768557948929,1530542959000.0,2018-07-02 07:49:19,-0800,,Guillermo. Mf’in. Ochoa. #WorldCup,es,['worldcup'],[],418944537,418944537,AztecaAmeliaaa,Amelia Lopez (Stay Home!),1,07,https://twitter.com/AztecaAmeliaaa/status/1013796768557948929,[],[],0,,False,10,1,3,,worldcup OR worldcup2018,,,,,,,[],,,,
26,1013520974744973312,1013520974744973312,1530477205000.0,2018-07-01 13:33:25,-0800,,"We going to PKs, ya’ll. AGAIN.   PKS in the #WorldCup  PKS in the #WorldCup  PKS in the #WorldCup  https://t.co/DJQfvviCpd",en,"['worldcup', 'worldcup', 'worldcup']",[],418944537,418944537,AztecaAmeliaaa,Amelia Lopez (Stay Home!),7,13,https://twitter.com/AztecaAmeliaaa/status/1013520974744973312,[],['https://pbs.twimg.com/tweet_video_thumb/DhC_8z6WAAE2n4j.jpg'],1,https://pbs.twimg.com/tweet_video_thumb/DhC_8z6WAAE2n4j.jpg,False,2,0,0,,worldcup OR worldcup2018,,,,,,,[],,,,
27,1013519092500725760,1013519092500725760,1530476756000.0,2018-07-01 13:25:56,-0800,,Only a yellow there? Wild #WorldCup this.,en,['worldcup'],[],418944537,418944537,AztecaAmeliaaa,Amelia Lopez (Stay Home!),7,13,https://twitter.com/AztecaAmeliaaa/status/1013519092500725760,[],[],0,,False,2,0,0,,worldcup OR worldcup2018,,,,,,,[],,,,
28,1013483554494242818,1013483554494242818,1530468283000.0,2018-07-01 11:04:43,-0800,,GOAL Croatia. It's not even 5 minutes in. Lmao.   #WorldCup,en,['worldcup'],[],418944537,418944537,AztecaAmeliaaa,Amelia Lopez (Stay Home!),7,11,https://twitter.com/AztecaAmeliaaa/status/1013483554494242818,[],[],0,,False,4,0,1,,worldcup OR worldcup2018,,,,,,,[],,,,
29,1013483222632550400,1013483222632550400,1530468204000.0,2018-07-01 11:03:24,-0800,,Went between the legs of *two* defenders and a bad deflection off the keeper.   The #WorldCup is wild.,en,['worldcup'],[],418944537,418944537,AztecaAmeliaaa,Amelia Lopez (Stay Home!),7,11,https://twitter.com/AztecaAmeliaaa/status/1013483222632550400,[],[],0,,False,4,0,0,,worldcup OR worldcup2018,,,,,,,[],,,,
30,1013461031685742592,1013461031685742592,1530462913000.0,2018-07-01 09:35:13,-0800,,PKS in the #WorldCup  PKS in the #WorldCup  PKS in the #WorldCup  https://t.co/vcQXrTdJ1c,en,"['worldcup', 'worldcup', 'worldcup']",[],418944537,418944537,AztecaAmeliaaa,Amelia Lopez (Stay Home!),7,09,https://twitter.com/AztecaAmeliaaa/status/1013461031685742592,[],['https://pbs.twimg.com/tweet_video_thumb/DhCJboSWkAI1GyR.jpg'],1,https://pbs.twimg.com/tweet_video_thumb/DhCJboSWkAI1GyR.jpg,False,2,0,0,,worldcup OR worldcup2018,,,,,,,[],,,,
31,1013453740236402688,1013453740236402688,1530461175000.0,2018-07-01 09:06:15,-0800,,I don’t think it goes to PKs. One of the team’s scores before ET is over. #WorldCup,en,['worldcup'],[],418944537,418944537,AztecaAmeliaaa,Amelia Lopez (Stay Home!),7,09,https://twitter.com/AztecaAmeliaaa/status/1013453740236402688,[],[],0,,False,1,0,0,,worldcup OR worldcup2018,,,,,,,[],,,,
32,1012401504337178630,1012401504337178630,1530210302000.0,2018-06-28 11:25:02,-0800,,This game is.... not good. #ENGBEL #WorldCup  https://t.co/JpSLZvvHXS,en,"['engbel', 'worldcup']",[],418944537,418944537,AztecaAmeliaaa,Amelia Lopez (Stay Home!),4,11,https://twitter.com/AztecaAmeliaaa/status/1012401504337178630,[],['https://pbs.twimg.com/tweet_video_thumb/DgzFy0qX4AE_1eF.jpg'],1,https://pbs.twimg.com/tweet_video_thumb/DgzFy0qX4AE_1eF.jpg,False,8,0,1,,worldcup OR worldcup2018,,,,,,,[],,,,
33,1011985953379028993,1011985953379028993,1530111227000.0,2018-06-27 07:53:47,-0800,,Still got nerves. Won’t be okay until that final whistle blows. But happy with the first half. #WorldCup,en,['worldcup'],[],418944537,418944537,AztecaAmeliaaa,Amelia Lopez (Stay Home!),3,07,https://twitter.com/AztecaAmeliaaa/status/1011985953379028993,[],[],0,,False,4,1,0,,worldcup OR worldcup2018,,,,,,,[],,,,
34,1011696696101867520,1011696696101867520,1530042263000.0,2018-06-26 12:44:23,-0800,,So tense this #ARG vs. #NGA !#WorldCup,en,"['arg', 'nga', 'worldcup']",[],418944537,418944537,AztecaAmeliaaa,Amelia Lopez (Stay Home!),2,12,https://twitter.com/AztecaAmeliaaa/status/1011696696101867520,[],[],0,,False,10,0,1,,worldcup OR worldcup2018,,,,,,,[],,,,
35,1011336379698163712,1011336379698163712,1529956357000.0,2018-06-25 12:52:37,-0800,,Damn. Golazo PK. Intensity growing.... #WorldCup,en,['worldcup'],[],418944537,418944537,AztecaAmeliaaa,Amelia Lopez (Stay Home!),1,12,https://twitter.com/AztecaAmeliaaa/status/1011336379698163712,[],[],0,,False,1,0,0,,worldcup OR worldcup2018,,,,,,,[],,,,
36,1011336119496081408,1011336119496081408,1529956295000.0,2018-06-25 12:51:35,-0800,,This is by VAR the craziest match I’ve seen. PK Iran. #WorldCup,en,['worldcup'],[],418944537,418944537,AztecaAmeliaaa,Amelia Lopez (Stay Home!),1,12,https://twitter.com/AztecaAmeliaaa/status/1011336119496081408,[],[],0,,False,23,3,3,,worldcup OR worldcup2018,,,,,,,[],,,,
37,1011334416763969536,1011334416763969536,1529955889000.0,2018-06-25 12:44:49,-0800,,Ronaldo with a missed PK and a yellow. Not the greatest of days for him. #WorldCup,en,['worldcup'],[],418944537,418944537,AztecaAmeliaaa,Amelia Lopez (Stay Home!),1,12,https://twitter.com/AztecaAmeliaaa/status/1011334416763969536,[],[],0,,False,1,0,0,,worldcup OR worldcup2018,,,,,,,[],,,,
38,1011325898920996864,1011325898920996864,1529953858000.0,2018-06-25 12:10:58,-0800,,Oh snaps. PK. Portugal. #WorldCup,in,['worldcup'],[],418944537,418944537,AztecaAmeliaaa,Amelia Lopez (Stay Home!),1,12,https://twitter.com/AztecaAmeliaaa/status/1011325898920996864,[],[],0,,False,3,0,0,,worldcup OR worldcup2018,,,,,,,[],,,,
39,1011311938666663937,1011311938666663937,1529950530000.0,2018-06-25 11:15:30,-0800,,Morocco with their first goal of the tournament. Nice. #WorldCup,en,['worldcup'],[],418944537,418944537,AztecaAmeliaaa,Amelia Lopez (Stay Home!),1,11,https://twitter.com/AztecaAmeliaaa/status/1011311938666663937,[],[],0,,False,7,0,0,,worldcup OR worldcup2018,,,,,,,[],,,,
40,1010972354292408325,1010972354292408325,1529869566000.0,2018-06-24 12:46:06,-0800,,That.... that was a bad free kick. #WorldCup  https://t.co/5eFg2qSlt7,en,['worldcup'],[],418944537,418944537,AztecaAmeliaaa,Amelia Lopez (Stay Home!),7,12,https://twitter.com/AztecaAmeliaaa/status/1010972354292408325,[],['https://pbs.twimg.com/tweet_video_thumb/Dgex_ZXVMAAuTeI.jpg'],1,https://pbs.twimg.com/tweet_video_thumb/Dgex_ZXVMAAuTeI.jpg,False,5,0,0,,worldcup OR worldcup2018,,,,,,,[],,,,
41,1010969789995651073,1010969789995651073,1529868955000.0,2018-06-24 12:35:55,-0800,,These goals from Colombia. Those passes are just as beautiful too. Well done. #WorldCup,en,['worldcup'],[],418944537,418944537,AztecaAmeliaaa,Amelia Lopez (Stay Home!),7,12,https://twitter.com/AztecaAmeliaaa/status/1010969789995651073,[],[],0,,False,25,0,8,,worldcup OR worldcup2018,,,,,,,[],,,,
42,1010612379229417472,1010612379229417472,1529783742000.0,2018-06-23 12:55:42,-0800,,Damn these golazos. Pure beauties. #WorldCup,en,['worldcup'],[],418944537,418944537,AztecaAmeliaaa,Amelia Lopez (Stay Home!),6,12,https://twitter.com/AztecaAmeliaaa/status/1010612379229417472,[],[],0,,False,4,0,0,,worldcup OR worldcup2018,,,,,,,[],,,,
43,1010596059628924930,1010596059628924930,1529779851000.0,2018-06-23 11:50:51,-0800,,"‘Chucky’ Lozano is the first horror movie-inspired nicknamed player to score in a #WorldCup   Not much of a stat, but there you go.   #ObscureStats2018 keep ‘em coming, guys  https://t.co/HXoca5sQhj",en,"['worldcup', 'obscurestats2018']",[],418944537,418944537,AztecaAmeliaaa,Amelia Lopez (Stay Home!),6,11,https://twitter.com/AztecaAmeliaaa/status/1010596059628924930,['https://twitter.com/fifaworldcup/status/1010242493294764032'],[],0,,False,16,0,5,https://twitter.com/fifaworldcup/status/1010242493294764032,worldcup OR worldcup2018,,,,,,,[],,,,
44,1010192627222896640,1010192627222896640,1529683665000.0,2018-06-22 09:07:45,-0800,,Golazo Nigeria #WorldCup,es,['worldcup'],[],418944537,418944537,AztecaAmeliaaa,Amelia Lopez (Stay Home!),5,09,https://twitter.com/AztecaAmeliaaa/status/1010192627222896640,[],[],0,,False,3,0,0,,worldcup OR worldcup2018,,,,,,,[],,,,
45,1009407846801387521,1009407846801387521,1529496559000.0,2018-06-20 05:09:19,-0800,,"He’s going for another hat trick, isn’t he? #WorldCup",en,['worldcup'],[],418944537,418944537,AztecaAmeliaaa,Amelia Lopez (Stay Home!),3,05,https://twitter.com/AztecaAmeliaaa/status/1009407846801387521,[],[],0,,False,0,0,0,,worldcup OR worldcup2018,,,,,,,[],,,,
46,1009406836875976706,1009406836875976706,1529496318000.0,2018-06-20 05:05:18,-0800,,Ronaldo. #WorldCup,es,['worldcup'],[],418944537,418944537,AztecaAmeliaaa,Amelia Lopez (Stay Home!),3,05,https://twitter.com/AztecaAmeliaaa/status/1009406836875976706,[],[],0,,False,0,0,0,,worldcup OR worldcup2018,,,,,,,[],,,,
47,1009156538399744000,1009156538399744000,1529436642000.0,2018-06-19 12:30:42,-0800,,Golaso Salah. 🙌🏽 #WorldCup,in,['worldcup'],[],418944537,418944537,AztecaAmeliaaa,Amelia Lopez (Stay Home!),2,12,https://twitter.com/AztecaAmeliaaa/status/1009156538399744000,[],[],0,,False,2,0,0,,worldcup OR worldcup2018,,,,,,,[],,,,
48,1009156197046366208,1009156197046366208,1529436561000.0,2018-06-19 12:29:21,-0800,,"That’s a PK, imo. #WorldCup",en,['worldcup'],[],418944537,418944537,AztecaAmeliaaa,Amelia Lopez (Stay Home!),2,12,https://twitter.com/AztecaAmeliaaa/status/1009156197046366208,[],[],0,,False,0,0,0,,worldcup OR worldcup2018,,,,,,,[],,,,
49,1009116976382468097,1009116976382468097,1529427210000.0,2018-06-19 09:53:30,-0800,,Let’s see what @MoSalah has in store for us tonight with #EGY   #WorldCup  https://t.co/5FDp04GF5v,en,"['egy', 'worldcup']",[],418944537,418944537,AztecaAmeliaaa,Amelia Lopez (Stay Home!),2,09,https://twitter.com/AztecaAmeliaaa/status/1009116976382468097,[],['https://pbs.twimg.com/media/DgEagXlU0AA-h_1.jpg'],1,https://pbs.twimg.com/media/DgEagXlU0AA-h_1.jpg,False,6,0,0,,worldcup OR worldcup2018,,,,,,,[],,,,
50,1008779803426729984,1008779803426729984,1529346822000.0,2018-06-18 11:33:42,-0800,,Welp. PK. #WorldCup,en,['worldcup'],[],418944537,418944537,AztecaAmeliaaa,Amelia Lopez (Stay Home!),1,11,https://twitter.com/AztecaAmeliaaa/status/1008779803426729984,[],[],0,,False,0,0,0,,worldcup OR worldcup2018,,,,,,,[],,,,
51,1007977858726334464,1007977858726334464,1529155623000.0,2018-06-16 06:27:03,-0800,,Iceland responding like   #WorldCup  https://t.co/e58ykj0kgR,en,['worldcup'],[],418944537,418944537,AztecaAmeliaaa,Amelia Lopez (Stay Home!),6,06,https://twitter.com/AztecaAmeliaaa/status/1007977858726334464,[],['https://pbs.twimg.com/tweet_video_thumb/Df0OgxjW0AE_Top.jpg'],1,https://pbs.twimg.com/tweet_video_thumb/Df0OgxjW0AE_Top.jpg,False,33,1,21,,worldcup OR worldcup2018,,,,,,,[],,,,
52,1007579518733815808,1007579518733815808,1529060651000.0,2018-06-15 04:04:11,-0800,,Pretty cool to see so many Peru 🇵🇪 fans here ready for the #WorldCup   Cc: @neaterguyonline  https://t.co/vc8NPQ7N8N,en,['worldcup'],[],418944537,418944537,AztecaAmeliaaa,Amelia Lopez (Stay Home!),5,04,https://twitter.com/AztecaAmeliaaa/status/1007579518733815808,[],['https://pbs.twimg.com/media/DfukDSpVMAEzYnQ.jpg'],1,https://pbs.twimg.com/media/DfukDSpVMAEzYnQ.jpg,False,7,0,1,,worldcup OR worldcup2018,,,,,,,[],,,,
53,1007328629817307136,1007328629817307136,1529000835000.0,2018-06-14 11:27:15,-0800,,A little 🇲🇽🆚🇩🇪 foosball at the airport right now as fans get ready to board our flight to Moscow.   #WorldCup  https://t.co/Jcwk5M5fYc,en,['worldcup'],[],418944537,418944537,AztecaAmeliaaa,Amelia Lopez (Stay Home!),4,11,https://twitter.com/AztecaAmeliaaa/status/1007328629817307136,[],[],1,https://pbs.twimg.com/ext_tw_video_thumb/1007327424789479425/pu/img/Ue3DRD8QOCEuuAbs.jpg,False,28,2,5,,worldcup OR worldcup2018,,,,,,,[],,,,
54,1007312920831815680,1007312920831815680,1528997089000.0,2018-06-14 10:24:49,-0800,,Standing behind some Germany 🇩🇪 fans as we check into our flight for Moscow.   “Dos A Cero” they say. 🙃  #WorldCup  https://t.co/DH7ePnZPwt,en,['worldcup'],[],418944537,418944537,AztecaAmeliaaa,Amelia Lopez (Stay Home!),4,10,https://twitter.com/AztecaAmeliaaa/status/1007312920831815680,[],['https://pbs.twimg.com/media/DfqxrgAWAAASOZR.jpg'],1,https://pbs.twimg.com/media/DfqxrgAWAAASOZR.jpg,False,15,2,0,,worldcup OR worldcup2018,,,,,,,[],,,,
55,1007308606344192000,1007308606344192000,1528996061000.0,2018-06-14 10:07:41,-0800,,Russia getting that solid goal differential and me here wondering why it couldn’t be 🇲🇽  #WorldCup  https://t.co/h6Fzi71jAQ,en,['worldcup'],[],418944537,418944537,AztecaAmeliaaa,Amelia Lopez (Stay Home!),4,10,https://twitter.com/AztecaAmeliaaa/status/1007308606344192000,[],['https://pbs.twimg.com/tweet_video_thumb/Dfqt0kRXcAAKb9U.jpg'],1,https://pbs.twimg.com/tweet_video_thumb/Dfqt0kRXcAAKb9U.jpg,False,2,0,0,,worldcup OR worldcup2018,,,,,,,[],,,,
56,1007278759026839554,1007278759026839554,1528988945000.0,2018-06-14 08:09:05,-0800,,"Happy #WorldCup  to everyone watching, traveling and working for the next couple of weeks. 🙌🏽⚽️  Currently in Norway and sad to report there are no Hot Cheetos.   Still... 🇷🇺🔜",en,['worldcup'],[],418944537,418944537,AztecaAmeliaaa,Amelia Lopez (Stay Home!),4,08,https://twitter.com/AztecaAmeliaaa/status/1007278759026839554,[],[],0,,False,17,3,0,,worldcup OR worldcup2018,,,,,,,[],,,,
57,936648452905189376,936648452905189376,1512149367000.0,2017-12-01 09:29:27,-0800,,So there it is.   Group F:  🇩🇪 Germany  🇲🇽 Mexico 🇸🇪 Sweden 🇰🇷 Korea Republic   It’s not the easiest nor the hardest but should be a true test to Mexico’s abilities. 👀  Now just waiting for the #WorldCup to get here. ⏳  #ElTriEng,en,"['worldcup', 'eltrieng']",[],418944537,418944537,AztecaAmeliaaa,Amelia Lopez (Stay Home!),5,09,https://twitter.com/AztecaAmeliaaa/status/936648452905189376,[],[],0,,False,2,0,0,,worldcup OR worldcup2018,,,,,,,[],,,,
