,id,conversation_id,created_at,date,timezone,place,tweet,language,hashtags,cashtags,user_id,user_id_str,username,name,day,hour,link,urls,photos,video,thumbnail,retweet,nlikes,nreplies,nretweets,quote_url,search,near,geo,source,user_rt_id,user_rt,retweet_id,reply_to,retweet_date,translate,trans_src,trans_dest
0,1018272287206887424,1018272287206887424,1531610006000.0,2018-07-14 16:13:26,-0800,,Only England can lose three games and still finish fourth at a World Cup !’ #BELENG #WorldCup2018,en,"['beleng', 'worldcup2018']",[],874346129244205059,874346129244205059,BasilPine,Piney,6,16,https://twitter.com/BasilPine/status/1018272287206887424,[],[],0,,False,0,0,0,,worldcup OR worldcup2018,,,,,,,[],,,,
1,1016783261002067968,1016783261002067968,1531254994000.0,2018-07-10 13:36:34,-0800,,Just off to put my mortgage on Gareth Southgate and the boys winning #spoty !! #WorldCup2018,en,"['spoty', 'worldcup2018']",[],874346129244205059,874346129244205059,BasilPine,Piney,2,13,https://twitter.com/BasilPine/status/1016783261002067968,[],[],0,,False,0,0,0,,worldcup OR worldcup2018,,,,,,,[],,,,
2,1015611214796410881,1015611214796410881,1530975557000.0,2018-07-07 07:59:17,-0800,,"@mattletiss7 can’t ever compare, let players be themselves in their own individual way #engswe #WorldCup",en,"['engswe', 'worldcup']",[],874346129244205059,874346129244205059,BasilPine,Piney,6,07,https://twitter.com/BasilPine/status/1015611214796410881,[],[],0,,False,0,0,0,,worldcup OR worldcup2018,,,,,,,[],,,,
3,1013871030379728896,1013871030379728896,1530560665000.0,2018-07-02 12:44:25,-0800,,@neymarjr can’t believe you cheat and roll around. You need to see real heroes with damaged limbs. You are a role model who failing miserably #WorldCupRussia2018 #WorldCup,en,"['worldcuprussia2018', 'worldcup']",[],874346129244205059,874346129244205059,BasilPine,Piney,1,12,https://twitter.com/BasilPine/status/1013871030379728896,[],[],0,,False,0,0,0,,worldcup OR worldcup2018,,,,,,,[],,,,
4,1013446199154798592,1013446199154798592,1530459377000.0,2018-07-01 08:36:17,-0800,,Andy Murray withdraws from Wimbledon citing the need to watch England Progress in the World Cup 🤣 #WorldCup #football #AndyMurray,en,"['worldcup', 'football', 'andymurray']",[],874346129244205059,874346129244205059,BasilPine,Piney,7,08,https://twitter.com/BasilPine/status/1013446199154798592,[],[],0,,False,0,0,0,,worldcup OR worldcup2018,,,,,,,[],,,,
5,1007707207226585088,1007707207226585088,1529091095000.0,2018-06-15 12:31:35,-0800,,Crisp pass from Nacho ......  #PORESP #WorldCupRussia2018 #WorldCup,en,"['poresp', 'worldcuprussia2018', 'worldcup']",[],874346129244205059,874346129244205059,BasilPine,Piney,5,12,https://twitter.com/BasilPine/status/1007707207226585088,[],[],0,,False,0,0,0,,worldcup OR worldcup2018,,,,,,,[],,,,
6,972884171579412487,972884171579412487,1520788636000.0,2018-03-11 10:17:16,-0800,,This is nuts. Harry Kane gets injured and suddenly England have no hope in the World Cup. As if we were going to win it before 🤣🤣🤣🤣🤣 #WorldCup2018 #harrykane,en,"['worldcup2018', 'harrykane']",[],874346129244205059,874346129244205059,BasilPine,Piney,7,10,https://twitter.com/BasilPine/status/972884171579412487,[],[],0,,False,0,0,0,,worldcup OR worldcup2018,,,,,,,[],,,,
