,id,conversation_id,created_at,date,timezone,place,tweet,language,hashtags,cashtags,user_id,user_id_str,username,name,day,hour,link,urls,photos,video,thumbnail,retweet,nlikes,nreplies,nretweets,quote_url,search,near,geo,source,user_rt_id,user_rt,retweet_id,reply_to,retweet_date,translate,trans_src,trans_dest
0,1018539661533249537,1018539661533249537,1531673753000.0,2018-07-15 09:55:53,-0800,,France wins. They beat Croatia 4-2. France has won the World Cup. Congratulations! #FRACRO #WorldCupFinal #WorldCup,en,"['fracro', 'worldcupfinal', 'worldcup']",[],313019411,313019411,bigheadjosh92,Joshua Cercado,7,09,https://twitter.com/bigheadjosh92/status/1018539661533249537,[],[],0,,False,0,0,0,,worldcup OR worldcup2018,,,,,,,[],,,,
1,1018275583359320066,1018275583359320066,1531610792000.0,2018-07-14 16:26:32,-0800,,WOW! Belgium beat England 2-0 to win 3rd Place game. Shocking. #BELENG #WorldCup,en,"['beleng', 'worldcup']",[],313019411,313019411,bigheadjosh92,Joshua Cercado,6,16,https://twitter.com/bigheadjosh92/status/1018275583359320066,[],[],0,,False,0,0,0,,worldcup OR worldcup2018,,,,,,,[],,,,
2,1017146791207284737,1017146791207284737,1531341667000.0,2018-07-11 13:41:07,-0800,,What an upset! Croatia beat England 2-1 in extra time. Amazing. They will face France in the final. #ENGCRO #WorldCup,en,"['engcro', 'worldcup']",[],313019411,313019411,bigheadjosh92,Joshua Cercado,3,13,https://twitter.com/bigheadjosh92/status/1017146791207284737,[],[],0,,False,0,0,0,,worldcup OR worldcup2018,,,,,,,[],,,,
3,1016773130512105472,1016773130512105472,1531252579000.0,2018-07-10 12:56:19,-0800,,France beat Belgium 1-0 and will move on to the World Cup Final. #FRABEL #WorldCup,en,"['frabel', 'worldcup']",[],313019411,313019411,bigheadjosh92,Joshua Cercado,2,12,https://twitter.com/bigheadjosh92/status/1016773130512105472,[],[],0,,False,0,0,0,,worldcup OR worldcup2018,,,,,,,[],,,,
4,1015702128646610944,1015702128646610944,1530997232000.0,2018-07-07 14:00:32,-0800,,England beat Sweden 2-0 and Croatia beat Russia 4-3 in penalty shootout. The semifinals has been revealed; France vs Belgium and England vs Croatia. #SWEENG #RUSCRO #WorldCup,en,"['sweeng', 'ruscro', 'worldcup']",[],313019411,313019411,bigheadjosh92,Joshua Cercado,6,14,https://twitter.com/bigheadjosh92/status/1015702128646610944,[],[],0,,False,0,0,0,,worldcup OR worldcup2018,,,,,,,[],,,,
5,1015328242146992129,1015328242146992129,1530908091000.0,2018-07-06 13:14:51,-0800,,"France beat Uruguay 2-0 and Belgium beat Brazil 2-1 in a shocking upset. Well, there goes Brazil. I'll wait for Saturday on who will I pick to win. #URUFRA #BRABEL #WorldCup",en,"['urufra', 'brabel', 'worldcup']",[],313019411,313019411,bigheadjosh92,Joshua Cercado,5,13,https://twitter.com/bigheadjosh92/status/1015328242146992129,[],[],0,,False,0,0,0,,worldcup OR worldcup2018,,,,,,,[],,,,
6,1014250881997557760,1014250881997557760,1530651228000.0,2018-07-03 13:53:48,-0800,,England beat Colombia in penalty shootout 4-3. WOW! Should have ended this game earlier if it wasn't for the headbutt goal. #COLENG #WorldCup,en,"['coleng', 'worldcup']",[],313019411,313019411,bigheadjosh92,Joshua Cercado,2,13,https://twitter.com/bigheadjosh92/status/1014250881997557760,[],[],0,,False,0,0,0,,worldcup OR worldcup2018,,,,,,,[],,,,
7,1014179810371915776,1014179810371915776,1530634283000.0,2018-07-03 09:11:23,-0800,,Sweden beat Switzerland 1-0. Good game. #SWESUI #WorldCup,en,"['swesui', 'worldcup']",[],313019411,313019411,bigheadjosh92,Joshua Cercado,2,09,https://twitter.com/bigheadjosh92/status/1014179810371915776,[],[],0,,False,0,0,0,,worldcup OR worldcup2018,,,,,,,[],,,,
8,1013893613355520001,1013893613355520001,1530566049000.0,2018-07-02 14:14:09,-0800,,Brazil beat Mexico 2-0 and Belgium beat Japan 3-1 in extra time. Just two games for the next day and we will see who vs who in the quarter-finals. #BRAMEX #BELJPN #WorldCup,en,"['bramex', 'beljpn', 'worldcup']",[],313019411,313019411,bigheadjosh92,Joshua Cercado,1,14,https://twitter.com/bigheadjosh92/status/1013893613355520001,[],[],0,,False,0,0,0,,worldcup OR worldcup2018,,,,,,,[],,,,
9,1013525106860183553,1013525106860183553,1530478190000.0,2018-07-01 13:49:50,-0800,,"Croatia won 3-2 in penalty shootout. Finally, should have done this earlier with that penalty kick. #CRODAN #CRODEN #WorldCup",en,"['crodan', 'croden', 'worldcup']",[],313019411,313019411,bigheadjosh92,Joshua Cercado,7,13,https://twitter.com/bigheadjosh92/status/1013525106860183553,[],[],0,,False,0,0,0,,worldcup OR worldcup2018,,,,,,,[],,,,
10,1013462892803448833,1013462892803448833,1530463357000.0,2018-07-01 09:42:37,-0800,,"DAMN! Russia beat Spain 4-3 in penalty shootout. There goes my pick to win. Well, I'm picking Brazil to win. #ESPRUS #WorldCup",en,"['esprus', 'worldcup']",[],313019411,313019411,bigheadjosh92,Joshua Cercado,7,09,https://twitter.com/bigheadjosh92/status/1013462892803448833,[],[],0,,False,0,0,0,,worldcup OR worldcup2018,,,,,,,[],,,,
11,1013150281234821120,1013150281234821120,1530388825000.0,2018-06-30 13:00:25,-0800,,"Uruguay won 2-1 against Portugal. Christiano Ronaldo is eliminated. Today, two best players are eliminated; Messi and Ronaldo #URUPOR #WorldCup",en,"['urupor', 'worldcup']",[],313019411,313019411,bigheadjosh92,Joshua Cercado,6,13,https://twitter.com/bigheadjosh92/status/1013150281234821120,[],[],0,,False,0,0,0,,worldcup OR worldcup2018,,,,,,,[],,,,
12,1013089749148536833,1013089749148536833,1530374393000.0,2018-06-30 08:59:53,-0800,,WOW. Great game. France comes back from 2-1 and won the game 4-3. Disappointing loss for Argentina. This is it for Messi. #FRAARG #WorldCup,en,"['fraarg', 'worldcup']",[],313019411,313019411,bigheadjosh92,Joshua Cercado,6,08,https://twitter.com/bigheadjosh92/status/1013089749148536833,[],[],0,,False,0,0,0,,worldcup OR worldcup2018,,,,,,,[],,,,
13,1012002996295741442,1012002996295741442,1530115291000.0,2018-06-27 09:01:31,-0800,,Germany lost and they are eliminated. Looks like we're gonna have a new champion this World Cup. #KORGER #WorldCup,en,"['korger', 'worldcup']",[],313019411,313019411,bigheadjosh92,Joshua Cercado,3,09,https://twitter.com/bigheadjosh92/status/1012002996295741442,[],[],0,,False,0,0,0,,worldcup OR worldcup2018,,,,,,,[],,,,
14,1012001874055229440,1012001874055229440,1530115023000.0,2018-06-27 08:57:03,-0800,,Unbelievable. Why the German goalkeeper leave his turf and go after the ball? You're asking for the other team to score a goal. Guess what?! It just happened. #KORGER #WorldCup,en,"['korger', 'worldcup']",[],313019411,313019411,bigheadjosh92,Joshua Cercado,3,08,https://twitter.com/bigheadjosh92/status/1012001874055229440,[],[],0,,False,0,0,0,,worldcup OR worldcup2018,,,,,,,[],,,,
15,1009885316646428676,1009885316646428676,1529610396000.0,2018-06-21 12:46:36,-0800,,"Wow! Argentina are done. First, Messi missed a penalty kick and now, the Goalkeeper idiotically lob the ball instead of kicking it led to a goal. Disappointing. #ARGCRO #FIFAWorldCup #WorldCup",en,"['argcro', 'fifaworldcup', 'worldcup']",[],313019411,313019411,bigheadjosh92,Joshua Cercado,4,12,https://twitter.com/bigheadjosh92/status/1009885316646428676,[],[],0,,False,0,0,0,,worldcup OR worldcup2018,,,,,,,[],,,,
