,id,conversation_id,created_at,date,timezone,place,tweet,language,hashtags,cashtags,user_id,user_id_str,username,name,day,hour,link,urls,photos,video,thumbnail,retweet,nlikes,nreplies,nretweets,quote_url,search,near,geo,source,user_rt_id,user_rt,retweet_id,reply_to,retweet_date,translate,trans_src,trans_dest
0,1018555727366017025,1018555727366017025,1531677583000.0,2018-07-15 10:59:43,-0800,,#WorldCup BBQ chez Hamlin.  https://t.co/trUyzgW0H9,en,['worldcup'],[],57884553,57884553,colincurryer,Colin Curryer,7,10,https://twitter.com/colincurryer/status/1018555727366017025,[],['https://pbs.twimg.com/media/DiKjB_XXUAIP7pQ.jpg'],1,https://pbs.twimg.com/media/DiKjB_XXUAIP7pQ.jpg,False,4,0,0,,worldcup OR worldcup2018,,,,,,,[],,,,
1,1018269584988786688,1018269584988786688,1531609362000.0,2018-07-14 16:02:42,-0800,,"So we expected nothing, we’re pleasantly surprised and then realise we lost to Croatia and Belgium (twice) but it’s still a success...   Yeah it’s been great an all that but let’s not go overboard. #ENG #WorldCup",en,"['eng', 'worldcup']",[],57884553,57884553,colincurryer,Colin Curryer,6,16,https://twitter.com/colincurryer/status/1018269584988786688,[],[],0,,False,1,1,0,,worldcup OR worldcup2018,,,,,,,[],,,,
2,1017311927230435329,1017311927230435329,1531381038000.0,2018-07-12 00:37:18,-0800,,"IF we now beat #BEL on Saturday, it will be the best result at a #WorldCup for #ENG since we won it in 1966, and whatever happens it will at least equal our second best result at the tournament ever. #Perspective #BrightSide 🦁🦁🦁",en,"['bel', 'worldcup', 'eng', 'perspective', 'brightside']",[],57884553,57884553,colincurryer,Colin Curryer,4,00,https://twitter.com/colincurryer/status/1017311927230435329,[],[],0,,False,5,0,0,,worldcup OR worldcup2018,,,,,,,[],,,,
3,1017146076724367361,1017146076724367361,1531341497000.0,2018-07-11 13:38:17,-0800,,We’re coming home. #ENG #WorldCup,en,"['eng', 'worldcup']",[],57884553,57884553,colincurryer,Colin Curryer,3,13,https://twitter.com/colincurryer/status/1017146076724367361,[],[],0,,False,0,0,0,,worldcup OR worldcup2018,,,,,,,[],,,,
4,1017120050376036352,1017120050376036352,1531335291000.0,2018-07-11 11:54:51,-0800,,How are we not 3 or 4 nil up!? This is bizarre...! #ENG #WorldCup,en,"['eng', 'worldcup']",[],57884553,57884553,colincurryer,Colin Curryer,3,11,https://twitter.com/colincurryer/status/1017120050376036352,[],[],0,,False,3,1,1,,worldcup OR worldcup2018,,,,,,,[],,,,
5,1017101278713966592,1017101278713966592,1531330816000.0,2018-07-11 10:40:16,-0800,,I was 14 last time we had a #WorldCup semi. #ENG,en,"['worldcup', 'eng']",[],57884553,57884553,colincurryer,Colin Curryer,3,10,https://twitter.com/colincurryer/status/1017101278713966592,[],[],0,,False,0,1,0,,worldcup OR worldcup2018,,,,,,,[],,,,
6,1016772930091585536,1016772930091585536,1531252531000.0,2018-07-10 12:55:31,-0800,,It’s wasn’t exactly the classic we were expecting but France look ominous. #FRA #BEL #WorldCup,en,"['fra', 'bel', 'worldcup']",[],57884553,57884553,colincurryer,Colin Curryer,2,12,https://twitter.com/colincurryer/status/1016772930091585536,[],[],0,,False,0,1,0,,worldcup OR worldcup2018,,,,,,,[],,,,
7,1016768117366755331,1016768117366755331,1531251384000.0,2018-07-10 12:36:24,-0800,,Is this semi final defined by excellent defending or poor finishing? #FRA #BEL #FRABEL #WorldCup,en,"['fra', 'bel', 'frabel', 'worldcup']",[],57884553,57884553,colincurryer,Colin Curryer,2,12,https://twitter.com/colincurryer/status/1016768117366755331,[],[],0,,False,0,1,0,,worldcup OR worldcup2018,,,,,,,[],,,,
8,1016750967969198080,1016750967969198080,1531247295000.0,2018-07-10 11:28:15,-0800,,Not sure this is going to finish 0-0. #FRA #BEL #WorldCup,en,"['fra', 'bel', 'worldcup']",[],57884553,57884553,colincurryer,Colin Curryer,2,11,https://twitter.com/colincurryer/status/1016750967969198080,[],[],0,,False,0,0,0,,worldcup OR worldcup2018,,,,,,,[],,,,
9,1015715332852461570,1015715332852461570,1531000381000.0,2018-07-07 14:53:01,-0800,,"I remember this feeling from 1990. A week later we had lost twice and within 4 years we even failed to qualify for rhe World Cup.   Basically, keep your feet on the ground peeps. #ENG #WorldCup",en,"['eng', 'worldcup']",[],57884553,57884553,colincurryer,Colin Curryer,6,14,https://twitter.com/colincurryer/status/1015715332852461570,[],[],0,,False,3,2,0,,worldcup OR worldcup2018,,,,,,,[],,,,
10,1015576761659256832,1015576761659256832,1530967343000.0,2018-07-07 05:42:23,-0800,,Let’s hope he’s fit enough to contribute today as he’s not offered much so far and we need all XI firing on all cylinders. #Eng #WorldCup  https://t.co/Glxfpjogux,en,"['eng', 'worldcup']",[],57884553,57884553,colincurryer,Colin Curryer,6,05,https://twitter.com/colincurryer/status/1015576761659256832,['https://twitter.com/henrywinter/status/1015576368342585346'],[],0,,False,3,1,0,https://twitter.com/henrywinter/status/1015576368342585346,worldcup OR worldcup2018,,,,,,,[],,,,
11,1015337680631197702,1015337680631197702,1530910341000.0,2018-07-06 13:52:21,-0800,,Unpopular opinion here: France or Belgium are going to win the #WorldCup. Probably France.,en,['worldcup'],[],57884553,57884553,colincurryer,Colin Curryer,5,13,https://twitter.com/colincurryer/status/1015337680631197702,[],[],0,,False,3,3,0,,worldcup OR worldcup2018,,,,,,,[],,,,
12,1014262995554373634,1014262995554373634,1530654116000.0,2018-07-03 14:41:56,-0800,,We made fucking hard work of that. Much to improve on for Saturday. For a start please let’s have Loftus-Cheek back in place of Deli Alli. He doesn’t look in anyway fit. #ENG #WorldCup,en,"['eng', 'worldcup']",[],57884553,57884553,colincurryer,Colin Curryer,2,14,https://twitter.com/colincurryer/status/1014262995554373634,[],[],0,,False,4,3,0,,worldcup OR worldcup2018,,,,,,,[],,,,
13,1014252070214488064,1014252070214488064,1530651512000.0,2018-07-03 13:58:32,-0800,,Colombia a definition:  Shithouses leaving the #WorldCup at the round of 16.,en,['worldcup'],[],57884553,57884553,colincurryer,Colin Curryer,2,13,https://twitter.com/colincurryer/status/1014252070214488064,[],[],0,,False,11,0,0,,worldcup OR worldcup2018,,,,,,,[],,,,
14,1013873626226053120,1013873626226053120,1530561284000.0,2018-07-02 12:54:44,-0800,,"Ow that was super, brutally clinical from Belgium. Unbelievable finish and so hard on Japan. #WorldCup",en,['worldcup'],[],57884553,57884553,colincurryer,Colin Curryer,1,12,https://twitter.com/colincurryer/status/1013873626226053120,[],[],0,,False,0,0,0,,worldcup OR worldcup2018,,,,,,,[],,,,
15,1013514542507347968,1013514542507347968,1530475671000.0,2018-07-01 13:07:51,-0800,,"After a frantic first 5 minutes, this game has descended into drudgery. #DEN #CRO #WorldCup",en,"['den', 'cro', 'worldcup']",[],57884553,57884553,colincurryer,Colin Curryer,7,13,https://twitter.com/colincurryer/status/1013514542507347968,[],[],0,,False,1,2,0,,worldcup OR worldcup2018,,,,,,,[],,,,
16,1013477973822001153,1013466179053260803,1530466953000.0,2018-07-01 10:42:33,-0800,,"@LewisWiltshire #CRO look to be the strongest side in that side of the draw. But as you have eloquently pointed out, this #WorldCup doesn’t respect who is better on paper.",en,"['cro', 'worldcup']",[],57884553,57884553,colincurryer,Colin Curryer,7,10,https://twitter.com/colincurryer/status/1013477973822001153,[],[],0,,False,0,0,0,,worldcup OR worldcup2018,,,,,,,"[{'screen_name': 'LewisWiltshire', 'name': 'Lewis Wiltshire', 'id': '14066247'}]",,,,
17,1013462890110750727,1013462890110750727,1530463356000.0,2018-07-01 09:42:36,-0800,,RIP Tippy Tappy football. #ESP #RUS #WorldCup,en,"['esp', 'rus', 'worldcup']",[],57884553,57884553,colincurryer,Colin Curryer,7,09,https://twitter.com/colincurryer/status/1013462890110750727,[],[],0,,False,2,0,0,,worldcup OR worldcup2018,,,,,,,[],,,,
18,1013088274666094592,1013088274666094592,1530374041000.0,2018-06-30 08:54:01,-0800,,Well that was a bit of a classic. #ARG #FRA #WorldCup,en,"['arg', 'fra', 'worldcup']",[],57884553,57884553,colincurryer,Colin Curryer,6,08,https://twitter.com/colincurryer/status/1013088274666094592,[],[],0,,False,2,1,0,,worldcup OR worldcup2018,,,,,,,[],,,,
19,1012571805993832449,1012571805993832449,1530250905000.0,2018-06-28 22:41:45,-0800,,I’m going to predict a #BEL #ESP #WorldCup Final.  https://t.co/Srsehu2P9m,en,"['bel', 'esp', 'worldcup']",[],57884553,57884553,colincurryer,Colin Curryer,4,22,https://twitter.com/colincurryer/status/1012571805993832449,[],['https://pbs.twimg.com/media/Dg1gr6kXkAA35xp.jpg'],1,https://pbs.twimg.com/media/Dg1gr6kXkAA35xp.jpg,False,2,1,0,,worldcup OR worldcup2018,,,,,,,[],,,,
20,1012442906072936448,1012417651090616322,1530220173000.0,2018-06-28 14:09:33,-0800,,@louismyles I can see both sides of it. Yeah on paper it’s a better draw to the semis but then we are in no way guarenteed ro beat any of #Col #Swe #Swi #WorldCup  Even if we do then it’s likely to be #CRO or #ESP. Hardly walkovers...,en,"['col', 'swe', 'swi', 'worldcup', 'cro', 'esp']",[],57884553,57884553,colincurryer,Colin Curryer,4,14,https://twitter.com/colincurryer/status/1012442906072936448,[],[],0,,False,0,1,0,,worldcup OR worldcup2018,,,,,,,"[{'screen_name': 'louismyles', 'name': 'Louis Myles', 'id': '17210426'}]",,,,
21,1012417651090616322,1012417651090616322,1530214152000.0,2018-06-28 12:29:12,-0800,,I think I’m right in saying that no team has won the #WorldCup after losing a group game at the same finals. So temper your enthusiasm peeps. #ENG,en,"['worldcup', 'eng']",[],57884553,57884553,colincurryer,Colin Curryer,4,12,https://twitter.com/colincurryer/status/1012417651090616322,[],[],0,,False,0,6,0,,worldcup OR worldcup2018,,,,,,,[],,,,
22,1012399752212672512,1012399752212672512,1530209885000.0,2018-06-28 11:18:05,-0800,,"I’m bored, can they put #PAN v #TUN on? #WorldCup #ENG #BEL",en,"['pan', 'tun', 'worldcup', 'eng', 'bel']",[],57884553,57884553,colincurryer,Colin Curryer,4,11,https://twitter.com/colincurryer/status/1012399752212672512,[],[],0,,False,2,0,0,,worldcup OR worldcup2018,,,,,,,[],,,,
23,1012385488513224706,1012385488513224706,1530206484000.0,2018-06-28 10:21:24,-0800,,Disappointed that it’s #ENG B v #BEL B at the #WorldCup tonight.,en,"['eng', 'bel', 'worldcup']",[],57884553,57884553,colincurryer,Colin Curryer,4,10,https://twitter.com/colincurryer/status/1012385488513224706,[],[],0,,False,0,1,0,,worldcup OR worldcup2018,,,,,,,[],,,,
24,1012240853597933568,1012240810228797441,1530172000000.0,2018-06-28 00:46:40,-0800,,I would not be overly surprised if we see a completely new winner of the #WorldCup this year.,en,['worldcup'],[],57884553,57884553,colincurryer,Colin Curryer,4,00,https://twitter.com/colincurryer/status/1012240853597933568,[],[],0,,False,0,2,0,,worldcup OR worldcup2018,,,,,,,[],,,,
25,1012240848917073920,1012240810228797441,1530171999000.0,2018-06-28 00:46:39,-0800,,In the end you have to think that there is no such thing as an easy route through a #WorldCup especially when #ENG haven’t won a knockout game at a major tournament since 2006. Plus on paper in #BEL we play one of the best teams in the World.,en,"['worldcup', 'eng', 'bel']",[],57884553,57884553,colincurryer,Colin Curryer,4,00,https://twitter.com/colincurryer/status/1012240848917073920,[],[],0,,False,2,1,0,,worldcup OR worldcup2018,,,,,,,[],,,,
26,1011730730517483520,1011698322388799488,1530050377000.0,2018-06-26 14:59:37,-0800,,"@markyerfdog @markhiggs71 Kent in the #WorldCup? I’m confused, is there other sport on apor something...!?",en,['worldcup'],[],57884553,57884553,colincurryer,Colin Curryer,2,14,https://twitter.com/colincurryer/status/1011730730517483520,[],[],0,,False,1,0,0,,worldcup OR worldcup2018,,,,,,,"[{'screen_name': 'markyerfdog', 'name': 'Mark Godfrey', 'id': '727433945973923840'}, {'screen_name': 'markhiggs71', 'name': 'Mark Higgs', 'id': '396722338'}]",,,,
27,1011709777733406720,1011696853312778243,1530045382000.0,2018-06-26 13:36:22,-0800,,@FB_WHISPERS #FRA v #ARG could be epic. #WorldCup,en,"['fra', 'arg', 'worldcup']",[],57884553,57884553,colincurryer,Colin Curryer,2,13,https://twitter.com/colincurryer/status/1011709777733406720,[],[],0,,False,0,0,0,,worldcup OR worldcup2018,,,,,,,"[{'screen_name': 'FB_WHISPERS', 'name': 'Football Whispers', 'id': '3578133981'}]",,,,
28,1011709460002365441,1011709460002365441,1530045306000.0,2018-06-26 13:35:06,-0800,,"Whilst I’m disappointed for @MatyRyan and @LeonBalogun as their #WorldCup journeys come to an end, I’m pleased they are uninjured and will be safely back at #bhafc sooner.   In the meantime, have a good rest boys, you both did the Albion proud! 💙",en,"['worldcup', 'bhafc']",[],57884553,57884553,colincurryer,Colin Curryer,2,13,https://twitter.com/colincurryer/status/1011709460002365441,[],[],0,,False,22,0,1,,worldcup OR worldcup2018,,,,,,,[],,,,
29,1011328200390184960,1011328200390184960,1529954407000.0,2018-06-25 12:20:07,-0800,,Not really sure what Mark Lawrenson is banging on about. It was a clear penalty and the fact Ronaldo wasn’t fully in control of the ball is irrelevant. #IRN #POR #WorldCup,en,"['irn', 'por', 'worldcup']",[],57884553,57884553,colincurryer,Colin Curryer,1,12,https://twitter.com/colincurryer/status/1011328200390184960,[],[],0,,False,5,2,0,,worldcup OR worldcup2018,,,,,,,[],,,,
30,1011246150136090625,1011246150136090625,1529934844000.0,2018-06-25 06:54:04,-0800,,"Out of interest Jake, are the commentators and co-commentators pre defined by the production team or is there someone chosing the parings Ryder Cup style game by game? #WorldCup  https://t.co/50Usr5GQ89",en,['worldcup'],[],57884553,57884553,colincurryer,Colin Curryer,1,06,https://twitter.com/colincurryer/status/1011246150136090625,['https://twitter.com/mrjakehumphrey/status/1010980516986785793'],[],0,,False,0,0,1,https://twitter.com/mrjakehumphrey/status/1010980516986785793,worldcup OR worldcup2018,,,,,,,[],,,,
31,1010896904585187328,1010896904585187328,1529851578000.0,2018-06-24 07:46:18,-0800,,Today reminds me of the 2002 #WorldCup when you found yourself having had a few beers and it was still the middle of the day! #afternoonnap,en,"['worldcup', 'afternoonnap']",[],57884553,57884553,colincurryer,Colin Curryer,7,07,https://twitter.com/colincurryer/status/1010896904585187328,[],[],0,,False,1,0,0,,worldcup OR worldcup2018,,,,,,,[],,,,
32,1010885168234663937,1010885168234663937,1529848780000.0,2018-06-24 06:59:40,-0800,,Satisfying afternoon watching #ENG at the #WorldCup  🦁🦁🦁,en,"['eng', 'worldcup']",[],57884553,57884553,colincurryer,Colin Curryer,7,06,https://twitter.com/colincurryer/status/1010885168234663937,[],[],0,,False,1,0,0,,worldcup OR worldcup2018,,,,,,,[],,,,
33,1010208005219110912,1010208005219110912,1529687331000.0,2018-06-22 10:08:51,-0800,,VAR is working wonders at identifying diving in the penalty box. Only problem is that the offenders are not getting yellow cards. When you deny the reward and inflict a punishment the message will get through quickly. #WorldCup,en,['worldcup'],[],57884553,57884553,colincurryer,Colin Curryer,5,10,https://twitter.com/colincurryer/status/1010208005219110912,[],[],0,,False,0,0,0,,worldcup OR worldcup2018,,,,,,,[],,,,
34,1009882410975195139,1009882410975195139,1529609704000.0,2018-06-21 12:35:04,-0800,,Argentina really are a bunch of dirty cheating bastards aren’t they. #ARG #CRO #WorldCup,en,"['arg', 'cro', 'worldcup']",[],57884553,57884553,colincurryer,Colin Curryer,4,12,https://twitter.com/colincurryer/status/1009882410975195139,[],[],0,,False,1,1,0,,worldcup OR worldcup2018,,,,,,,[],,,,
35,1009834013111017477,1009834013111017477,1529598165000.0,2018-06-21 09:22:45,-0800,,Come on #Per #worldcup,en,"['per', 'worldcup']",[],57884553,57884553,colincurryer,Colin Curryer,4,09,https://twitter.com/colincurryer/status/1009834013111017477,[],[],0,,False,0,0,0,,worldcup OR worldcup2018,,,,,,,[],,,,
36,1009432122623447040,1009432122623447040,1529502347000.0,2018-06-20 06:45:47,-0800,,Foul!? That was fucking dive by Ronaldo the contact was not enough to cause him to jump up and over and collapse into a heap. Clear and blatant attempt to con the ref. #POR #MOR #WorldCup2018,en,"['por', 'mor', 'worldcup2018']",[],57884553,57884553,colincurryer,Colin Curryer,3,06,https://twitter.com/colincurryer/status/1009432122623447040,[],[],0,,False,0,0,0,,worldcup OR worldcup2018,,,,,,,[],,,,
37,1008803497385525249,1008803497385525249,1529352471000.0,2018-06-18 13:07:51,-0800,,"Not quite sure what VAR is for if it’s not for the wrestling shown by the Tunisian defenders. That said, fair result in the end. #ENGvTUN #WorldCup",en,"['engvtun', 'worldcup']",[],57884553,57884553,colincurryer,Colin Curryer,1,13,https://twitter.com/colincurryer/status/1008803497385525249,[],[],0,,False,2,0,0,,worldcup OR worldcup2018,,,,,,,[],,,,
38,1008801416394280960,1008801416394280960,1529351974000.0,2018-06-18 12:59:34,-0800,,To be fair Harry Kane had a better chance when their defenders weren’t grappling with our attackers. #WorldCup #Eng,en,"['worldcup', 'eng']",[],57884553,57884553,colincurryer,Colin Curryer,1,12,https://twitter.com/colincurryer/status/1008801416394280960,[],[],0,,False,0,0,0,,worldcup OR worldcup2018,,,,,,,[],,,,
39,1008800931624947712,1008800931624947712,1529351859000.0,2018-06-18 12:57:39,-0800,,"Typical first game at a major tournament for #ENG. The wife took that as negative but it wasn’t, it fits the pattern. We made hard work of a game we should have won more convincingly. #WorldCup",en,"['eng', 'worldcup']",[],57884553,57884553,colincurryer,Colin Curryer,1,12,https://twitter.com/colincurryer/status/1008800931624947712,[],[],0,,False,0,0,0,,worldcup OR worldcup2018,,,,,,,[],,,,
40,1008797407440711682,1008797407440711682,1529351019000.0,2018-06-18 12:43:39,-0800,,The Tunisian players go down easier than Anthony Knockaert. #eng #tun #WorldCup,en,"['eng', 'tun', 'worldcup']",[],57884553,57884553,colincurryer,Colin Curryer,1,12,https://twitter.com/colincurryer/status/1008797407440711682,[],[],0,,False,0,0,0,,worldcup OR worldcup2018,,,,,,,[],,,,
41,1008782762147569666,1008782762147569666,1529347527000.0,2018-06-18 11:45:27,-0800,,Lingard could have won the Golden Boot already.  #ENG #TUN #WorldCup,en,"['eng', 'tun', 'worldcup']",[],57884553,57884553,colincurryer,Colin Curryer,1,11,https://twitter.com/colincurryer/status/1008782762147569666,[],[],0,,False,2,0,0,,worldcup OR worldcup2018,,,,,,,[],,,,
42,1008774491311394821,1008774491311394821,1529345555000.0,2018-06-18 11:12:35,-0800,,Yes!!! Decent start by #Eng just hope they have t shot their bolt early. #WorldCup #ENGvsTUN,en,"['eng', 'worldcup', 'engvstun']",[],57884553,57884553,colincurryer,Colin Curryer,1,11,https://twitter.com/colincurryer/status/1008774491311394821,[],[],0,,False,0,0,0,,worldcup OR worldcup2018,,,,,,,[],,,,
43,1008651252555767808,1008651252555767808,1529316173000.0,2018-06-18 03:02:53,-0800,,The nearer we get to England’s opening game of the #WorldCup the better they have become in peoples minds. Reminds me of an injured player who is missed and expectations rise for their return.   Let’s just take a view after the game this evening and again at the end of the group.,en,['worldcup'],[],57884553,57884553,colincurryer,Colin Curryer,1,03,https://twitter.com/colincurryer/status/1008651252555767808,[],[],0,,False,3,2,0,,worldcup OR worldcup2018,,,,,,,[],,,,
44,1008346466304262149,1008346466304262149,1529243506000.0,2018-06-17 06:51:46,-0800,,A bit of a shock result this... #Hoddle #Lawrenson #WorldCup #BadPundits  https://t.co/lHDdqbw6w1,en,"['hoddle', 'lawrenson', 'worldcup', 'badpundits']",[],57884553,57884553,colincurryer,Colin Curryer,7,06,https://twitter.com/colincurryer/status/1008346466304262149,['https://twitter.com/colincurryer/status/1007976582928109569'],[],0,,False,0,0,0,https://twitter.com/colincurryer/status/1007976582928109569,worldcup OR worldcup2018,,,,,,,[],,,,
45,1007977291392147456,1007977291392147456,1529155488000.0,2018-06-16 06:24:48,-0800,,Is #ARGvICE the new #PORvESP?  #WorldCup #ARG #ICE #POR #ESP,en,"['argvice', 'porvesp', 'worldcup', 'arg', 'ice', 'por', 'esp']",[],57884553,57884553,colincurryer,Colin Curryer,6,06,https://twitter.com/colincurryer/status/1007977291392147456,[],[],0,,False,0,0,0,,worldcup OR worldcup2018,,,,,,,[],,,,
46,1007976582928109569,1007976582928109569,1529155319000.0,2018-06-16 06:21:59,-0800,,Ok who is worse to listen to co-commentating: Please RT for a bigger sample size. #WorldCup #BBC #ITV,en,"['worldcup', 'bbc', 'itv']",[],57884553,57884553,colincurryer,Colin Curryer,6,06,https://twitter.com/colincurryer/status/1007976582928109569,[],[],0,,False,0,5,12,,worldcup OR worldcup2018,,,,,,,[],,,,
47,1007935290160410625,1007935290160410625,1529145474000.0,2018-06-16 03:37:54,-0800,,Teams I am supporting at the #WorldCup: 1. #ENG wait where’s @lewisdunk or @GM_83 !?  2. #COL @JoseIzquierdo7  3. #AUS @MatyRyan  4. #NGA @LeonBalogun  #bhafc,en,"['worldcup', 'eng', 'col', 'aus', 'nga', 'bhafc']",[],57884553,57884553,colincurryer,Colin Curryer,6,03,https://twitter.com/colincurryer/status/1007935290160410625,[],[],0,,False,2,0,0,,worldcup OR worldcup2018,,,,,,,[],,,,
48,1007709507659673602,1007709507659673602,1529091643000.0,2018-06-15 12:40:43,-0800,,If Spain make Ronaldo cry do they get a bonus point? #WorldCup #Por #Spa,en,"['worldcup', 'por', 'spa']",[],57884553,57884553,colincurryer,Colin Curryer,5,12,https://twitter.com/colincurryer/status/1007709507659673602,[],[],0,,False,4,0,2,,worldcup OR worldcup2018,,,,,,,[],,,,
49,1007690460419252224,1007690460419252224,1529087102000.0,2018-06-15 11:25:02,-0800,,Pepe went down easier than Ronaldo there. Get up you fucking twat. #PORSPA #worldcup,en,"['porspa', 'worldcup']",[],57884553,57884553,colincurryer,Colin Curryer,5,11,https://twitter.com/colincurryer/status/1007690460419252224,[],[],0,,False,3,0,0,,worldcup OR worldcup2018,,,,,,,[],,,,
50,1006953006926123008,1006929928120619014,1528911279000.0,2018-06-13 10:34:39,-0800,,@markhiggs71 The one decent one I got went and sacked their manager today... #FFSSpain #WorldCup,en,"['ffsspain', 'worldcup']",[],57884553,57884553,colincurryer,Colin Curryer,3,10,https://twitter.com/colincurryer/status/1006953006926123008,[],[],0,,False,0,0,0,,worldcup OR worldcup2018,,,,,,,"[{'screen_name': 'markhiggs71', 'name': 'Mark Higgs', 'id': '396722338'}]",,,,
51,1006625047086321664,1006625047086321664,1528833088000.0,2018-06-12 12:51:28,-0800,,An eclectic mix in the office sweepstake today... #worldcup  https://t.co/y90q9vbR51,en,['worldcup'],[],57884553,57884553,colincurryer,Colin Curryer,2,12,https://twitter.com/colincurryer/status/1006625047086321664,[],['https://pbs.twimg.com/media/DfhAI4NXUAAsTF5.jpg'],1,https://pbs.twimg.com/media/DfhAI4NXUAAsTF5.jpg,False,3,1,0,,worldcup OR worldcup2018,,,,,,,[],,,,
