,id,conversation_id,created_at,date,timezone,place,tweet,language,hashtags,cashtags,user_id,user_id_str,username,name,day,hour,link,urls,photos,video,thumbnail,retweet,nlikes,nreplies,nretweets,quote_url,search,near,geo,source,user_rt_id,user_rt,retweet_id,reply_to,retweet_date,translate,trans_src,trans_dest
0,1149242055790649344,1149242055790649344,1562835632000.0,2019-07-11 02:00:32,-0800,,"""At the current moment, the Women's #WorldCup is not a top-tier event in the vein as the Olympics or the men's #soccer championship, that passes the geopolitical threshold. But its profile is destined to increasingly grow in that direction."" From @ozyurtcu  https://t.co/ExDa7fJinG",en,"['worldcup', 'soccer']",[],28350927,28350927,Stratfor,Stratfor - a RANE Company,4,02,https://twitter.com/Stratfor/status/1149242055790649344,['http://ow.ly/XXLp50uXF0c'],[],0,,False,3,0,3,,worldcup OR worldcup2018,,,,,,,[],,,,
1,1149060876760170497,1149060876760170497,1562792436000.0,2019-07-10 14:00:36,-0800,,"""Despite its wide reach and international diversity, one of the most notable aspects of the Women's #WorldCup, in general, seems to be its disconnection from underlying #geopolitical forces."" From contributor @ozyurtcu.  https://t.co/SkMDcgyeP2",en,"['worldcup', 'geopolitical']",[],28350927,28350927,Stratfor,Stratfor - a RANE Company,3,14,https://twitter.com/Stratfor/status/1149060876760170497,['http://ow.ly/i2je50uXEvs'],[],0,,False,2,0,1,,worldcup OR worldcup2018,,,,,,,[],,,,
2,1149000563180355591,1149000563180355591,1562778056000.0,2019-07-10 10:00:56,-0800,,"""Almost all of the meaningful indicators portend that as the Women's #WorldCup matures, everything about it will increase globally."" From contributor @ozyurtcu.  https://t.co/zPjnupfyal",en,['worldcup'],[],28350927,28350927,Stratfor,Stratfor - a RANE Company,3,10,https://twitter.com/Stratfor/status/1149000563180355591,['http://ow.ly/WAau50uXDvO'],[],0,,False,1,0,2,,worldcup OR worldcup2018,,,,,,,[],,,,
3,1018577204136071169,1018577204136071169,1531682704000.0,2018-07-15 12:25:04,-0800,,"Nearly 10% of the athletes in the #WorldCup played under the flag of a nation they weren't born in. Despite the buzz, the practice isn't a recent phenomenon, tracing back at least to 1934. #GeopoliticsOfSports contributor @ozyurtcu explains.  https://t.co/IqglNJG8co",en,"['worldcup', 'geopoliticsofsports']",[],28350927,28350927,Stratfor,Stratfor - a RANE Company,7,12,https://twitter.com/Stratfor/status/1018577204136071169,['http://ow.ly/upyb30kXAPc'],[],0,,False,37,0,14,,worldcup OR worldcup2018,,,,,,,[],,,,
4,1018572707514994689,1018572707514994689,1531681632000.0,2018-07-15 12:07:12,-0800,,"Despite the #WorldCup's success as a diversionary tactic, it will do little to assuage #Russians' #economic and political grievances in the long run. Contributor @Balticfreelance explains.  https://t.co/ERwHhA10Tu",en,"['worldcup', 'russians', 'economic']",[],28350927,28350927,Stratfor,Stratfor - a RANE Company,7,12,https://twitter.com/Stratfor/status/1018572707514994689,['http://ow.ly/zEij30kXAJL'],[],0,,False,11,0,5,,worldcup OR worldcup2018,,,,,,,[],,,,
5,1018281514243588098,1018281514243588098,1531612206000.0,2018-07-14 16:50:06,-0800,,"Despite the success of the #WorldCup as a diversionary tactic for Vladimir #Putin, it will do little to assuage the economic and political grievances in #Russia in the long run, writes contributor @Jegelevicius.  https://t.co/nGKMLW84ro  https://t.co/L7BpEOyuPp",en,"['worldcup', 'putin', 'russia']",[],28350927,28350927,Stratfor,Stratfor - a RANE Company,6,16,https://twitter.com/Stratfor/status/1018281514243588098,['http://ow.ly/mSp930kX7S7'],['https://pbs.twimg.com/media/DiGpo9vWkAAi7Ie.jpg'],1,https://pbs.twimg.com/media/DiGpo9vWkAAi7Ie.jpg,False,4,0,3,,worldcup OR worldcup2018,,,,,,,[],,,,
6,1018204777417764865,1018204777417764865,1531593910000.0,2018-07-14 11:45:10,-0800,,Vladimir #Putin has been using the #WorldCup to upstage the political turmoil in and around #Russia. But all good tournaments come to an end. From contributor @Jegelevicius  https://t.co/OdjGImCMkr  https://t.co/WLi4X0hGdW,en,"['putin', 'worldcup', 'russia']",[],28350927,28350927,Stratfor,Stratfor - a RANE Company,6,11,https://twitter.com/Stratfor/status/1018204777417764865,['http://ow.ly/x33t30kX7P2'],['https://pbs.twimg.com/media/DiFj2SWX4AUYi0E.jpg'],1,https://pbs.twimg.com/media/DiFj2SWX4AUYi0E.jpg,False,3,2,5,,worldcup OR worldcup2018,,,,,,,[],,,,
7,1018141514378240000,1018141514378240000,1531578827000.0,2018-07-14 07:33:47,-0800,,"The #WorldCup has turned attention in #Russia and abroad away from the country's political and economic problems, writes contributor @Jegelevicius. Once the soccer frenzy dies, though, Russian President Vladimir #Putin will have to face the music.  https://t.co/oZCiU2FX0u  https://t.co/yfNyZfB5Qc",en,"['worldcup', 'russia', 'putin']",[],28350927,28350927,Stratfor,Stratfor - a RANE Company,6,07,https://twitter.com/Stratfor/status/1018141514378240000,['http://ow.ly/U9EY30kX7DV'],['https://pbs.twimg.com/media/DiEqT4IWAAEH0E6.jpg'],1,https://pbs.twimg.com/media/DiEqT4IWAAEH0E6.jpg,False,4,0,7,,worldcup OR worldcup2018,,,,,,,[],,,,
8,1017646081990152192,1017646081990152192,1531460707000.0,2018-07-12 22:45:07,-0800,,"The demonstrations in #Russia against pension reform have been generally small so far. But the movement has persisted, and once the #WorldCup concludes, protests could again be held in larger cities. Rallies could grow in size, scope in the coming weeks.  https://t.co/75MAmGpY2L  https://t.co/8zYGruxwcC",en,"['russia', 'worldcup']",[],28350927,28350927,Stratfor,Stratfor - a RANE Company,4,22,https://twitter.com/Stratfor/status/1017646081990152192,['http://ow.ly/1Uff30kVdDT'],['https://pbs.twimg.com/media/Dh9nt82UcAAW1-c.jpg'],1,https://pbs.twimg.com/media/Dh9nt82UcAAW1-c.jpg,False,9,0,5,,worldcup OR worldcup2018,,,,,,,[],,,,
9,1017510204722774018,1017510204722774018,1531428311000.0,2018-07-12 13:45:11,-0800,,"The long-expected plan to raise the #retirement #age has spurred #protests across #Russia, and demonstrations could grow in size and scope once the #WorldCup ends and host cities lift their moratoriums on public protests.  https://t.co/Aj5fDWcSzl  https://t.co/Ie9q0Ptdyg",en,"['retirement', 'age', 'protests', 'russia', 'worldcup']",[],28350927,28350927,Stratfor,Stratfor - a RANE Company,4,13,https://twitter.com/Stratfor/status/1017510204722774018,['http://ow.ly/wmK630kVcXs'],['https://pbs.twimg.com/media/Dh7sI3oUYAEeRCJ.jpg'],1,https://pbs.twimg.com/media/Dh7sI3oUYAEeRCJ.jpg,False,7,0,3,,worldcup OR worldcup2018,,,,,,,[],,,,
10,1011446472787800064,1011446472787800064,1529982605000.0,2018-06-25 20:10:05,-0800,,The FIFA #WorldCup is second only to the #OlympicGames in terms of geopolitical implications and imagery. But is #nationality a relative term in this year’s tournament? Contributor @ozyurtcu explains.  https://t.co/jxEIo56B3N  https://t.co/6m6LGG8Aw3,en,"['worldcup', 'olympicgames', 'nationality']",[],28350927,28350927,Stratfor,Stratfor - a RANE Company,1,20,https://twitter.com/Stratfor/status/1011446472787800064,['http://ow.ly/OrlY30kEviS'],['https://pbs.twimg.com/media/DglhNI6X4AAFar3.jpg'],1,https://pbs.twimg.com/media/DglhNI6X4AAFar3.jpg,False,3,0,4,,worldcup OR worldcup2018,,,,,,,[],,,,
11,1011386092837396484,1011386092837396484,1529968209000.0,2018-06-25 16:10:09,-0800,,"The normalization of player movement in pursuit of sporting success suggests that the beautiful, maddening game of soccer and the #WorldCup is still about more than the final score. Contributor @ozyurtcu explains in this week's #GeopoliticsOfSports.  https://t.co/9g2y3n1eig  https://t.co/iQYhg8hWwH",en,"['worldcup', 'geopoliticsofsports']",[],28350927,28350927,Stratfor,Stratfor - a RANE Company,1,16,https://twitter.com/Stratfor/status/1011386092837396484,['http://ow.ly/vCdv30kEuMP'],['https://pbs.twimg.com/media/DgkqSgEU0AAwn96.jpg'],1,https://pbs.twimg.com/media/DgkqSgEU0AAwn96.jpg,False,2,0,0,,worldcup OR worldcup2018,,,,,,,[],,,,
12,1011325717055987712,1011325717055987712,1529953815000.0,2018-06-25 12:10:15,-0800,,"Nearly 10% of athletes competing in the 2018 #WorldCup are playing under the flag of a nation they weren't born in. Despite the buzz, the practice isn't a recent phenomenon, tracing back at least to the 1934 World Cup in #Italy. From contributor @ozyurtcu.  https://t.co/9FVJzjcff7  https://t.co/Khi3khW4LS",en,"['worldcup', 'italy']",[],28350927,28350927,Stratfor,Stratfor - a RANE Company,1,12,https://twitter.com/Stratfor/status/1011325717055987712,['http://ow.ly/yS8e30kEumc'],['https://pbs.twimg.com/media/DgjzYK8X4AEVlyv.jpg'],1,https://pbs.twimg.com/media/DgjzYK8X4AEVlyv.jpg,False,2,0,3,,worldcup OR worldcup2018,,,,,,,[],,,,
13,1011265301462298625,1011265301462298625,1529939410000.0,2018-06-25 08:10:10,-0800,,"Sports commentators are having a field day with stories of the many athletes who are competing in the #WorldCup for countries they weren't born in. As the 1934 tournament illustrates, however, the practice is nothing new. Contributor @ozyurtcu explains.  https://t.co/UEEVRAhRu6  https://t.co/7paQZW8f3D",en,['worldcup'],[],28350927,28350927,Stratfor,Stratfor - a RANE Company,1,08,https://twitter.com/Stratfor/status/1011265301462298625,['http://ow.ly/QpEn30kEueT'],['https://pbs.twimg.com/media/Dgi8bflWsAEHUV8.jpg'],1,https://pbs.twimg.com/media/Dgi8bflWsAEHUV8.jpg,False,0,1,1,,worldcup OR worldcup2018,,,,,,,[],,,,
14,1009292310121676800,1009292310121676800,1529469013000.0,2018-06-19 21:30:13,-0800,,Some dependent territories are FIFA members - but there are actually a few independent countries that still aren't. Which countries aren't members of FIFA #WorldCup? Our partners @PolGeoNow explain.  https://t.co/unr1LNFvTT  https://t.co/xxbSxqqI8Z,en,['worldcup'],[],28350927,28350927,Stratfor,Stratfor - a RANE Company,2,21,https://twitter.com/Stratfor/status/1009292310121676800,['http://ow.ly/SLjf30kzibg'],['https://pbs.twimg.com/media/DgG6AaHWsAAl2F7.jpg'],1,https://pbs.twimg.com/media/DgG6AaHWsAAl2F7.jpg,False,9,1,5,,worldcup OR worldcup2018,,,,,,,[],,,,
15,1009231928334090240,1009231928334090240,1529454616000.0,2018-06-19 17:30:16,-0800,,Which countries qualified for the 2018 FIFA #WorldCup in Russia? Our partners @PolGeoNow  provide a full #map of eligible national teams this year.  https://t.co/zdByHO14Cm  https://t.co/oN0jScTCCo,en,"['worldcup', 'map']",[],28350927,28350927,Stratfor,Stratfor - a RANE Company,2,17,https://twitter.com/Stratfor/status/1009231928334090240,['http://ow.ly/QVeO30kzhUV'],['https://pbs.twimg.com/media/DgGDFwIV4AAv6kS.jpg'],1,https://pbs.twimg.com/media/DgGDFwIV4AAv6kS.jpg,False,2,1,1,,worldcup OR worldcup2018,,,,,,,[],,,,
16,1009171553697849354,1009171553697849354,1529440222000.0,2018-06-19 13:30:22,-0800,,Our partners at @PolGeoNow offer an up-to-date look at which FIFA members and non-members are competing in this year's #WorldCup.  https://t.co/ruoBuyKmWM  https://t.co/eCjbCqdOAp,en,['worldcup'],[],28350927,28350927,Stratfor,Stratfor - a RANE Company,2,13,https://twitter.com/Stratfor/status/1009171553697849354,['http://ow.ly/mWsA30kzhPv'],['https://pbs.twimg.com/media/DgFMLdmWkAAeXDl.jpg'],1,https://pbs.twimg.com/media/DgFMLdmWkAAeXDl.jpg,False,4,2,4,,worldcup OR worldcup2018,,,,,,,[],,,,
17,1009111114280591361,1009111114280591361,1529425812000.0,2018-06-19 09:30:12,-0800,,"Around the world, fans are tuning in for the FIFA #WorldCup. Not all the world's countries can advance to the cup, but did they all get a shot at it? Read on for a @PolGeoNow exclusive guide to the roster of FIFA national football teams.  https://t.co/pxdCfZr9Tf  https://t.co/kL2yeZXLOp",en,['worldcup'],[],28350927,28350927,Stratfor,Stratfor - a RANE Company,2,09,https://twitter.com/Stratfor/status/1009111114280591361,['http://ow.ly/ouwr30kzi37'],['https://pbs.twimg.com/media/DgEVNeAWsAAe8Ao.jpg'],1,https://pbs.twimg.com/media/DgEVNeAWsAAe8Ao.jpg,False,5,1,6,,worldcup OR worldcup2018,,,,,,,[],,,,
18,1007771010354073601,1007771010354073601,1529106307000.0,2018-06-15 16:45:07,-0800,,"How many countries are there in the world? It's a basic questions for #map-lovers. For a soccer super-fan watching the #WorldCup, the answer is 211 -- the number of member associations that compete in FIFA matches. #GeopoliticalWorldCup  https://t.co/dSYyRWVVYJ  https://t.co/KUgW1pZhxj",en,"['map', 'worldcup', 'geopoliticalworldcup']",[],28350927,28350927,Stratfor,Stratfor - a RANE Company,5,16,https://twitter.com/Stratfor/status/1007771010354073601,['http://ow.ly/2bTI30kwjD6'],['https://pbs.twimg.com/media/DfxSZJYX4AECLcz.jpg'],1,https://pbs.twimg.com/media/DfxSZJYX4AECLcz.jpg,False,16,0,8,,worldcup OR worldcup2018,,,,,,,[],,,,
19,1007687297373007873,1007687297373007873,1529086348000.0,2018-06-15 11:12:28,-0800,,⚡️ “The 2018 #WorldCup”   https://t.co/zX33kMKybD,und,['worldcup'],[],28350927,28350927,Stratfor,Stratfor - a RANE Company,5,11,https://twitter.com/Stratfor/status/1007687297373007873,['https://twitter.com/i/moments/1007675542336933888'],[],0,,False,3,0,2,,worldcup OR worldcup2018,,,,,,,[],,,,
20,1007291242584182784,1007291242584182784,1528991921000.0,2018-06-14 08:58:41,-0800,,"How many countries are there in the world? It's one of the most basic questions for #map-lovers. For a soccer super-fan on the opening day of the #WorldCup, the answer is 211 -- the number of member associations that compete in FIFA matches.  Learn more:  https://t.co/E7E4iHlHVD  https://t.co/dS4LRwDS49",en,"['map', 'worldcup']",[],28350927,28350927,Stratfor,Stratfor - a RANE Company,4,08,https://twitter.com/Stratfor/status/1007291242584182784,['http://ow.ly/1UNm30kuYAo'],['https://pbs.twimg.com/media/DfqeC_BWsAA9-3Q.jpg'],1,https://pbs.twimg.com/media/DfqeC_BWsAA9-3Q.jpg,False,5,1,8,,worldcup OR worldcup2018,,,,,,,[],,,,
21,978368603601981441,978368603601981441,1522096226000.0,2018-03-26 13:30:26,-0800,,"As athletes and spectators prepare for the 2018 #WorldCup, the tension between #Russia and the West could cast a shadow over the event following the nerve agent attack on Sergei #Skripal. Contributor @ozyurtcu explains.  https://t.co/sQ552eDILN  https://t.co/trWEWtLfF7",en,"['worldcup', 'russia', 'skripal']",[],28350927,28350927,Stratfor,Stratfor - a RANE Company,1,13,https://twitter.com/Stratfor/status/978368603601981441,['http://ow.ly/vkT630j9Obe'],['https://pbs.twimg.com/media/DZPdDq6VMAATGdx.jpg'],1,https://pbs.twimg.com/media/DZPdDq6VMAATGdx.jpg,False,1,0,1,,worldcup OR worldcup2018,,,,,,,[],,,,
22,978323338794856448,978323338794856448,1522085434000.0,2018-03-26 10:30:34,-0800,,"The nerve agent attack on Sergei #Skripal has strained relations between #Russia and the West. But as contributor @ozyurtcu explains, a boycott of a major #sports event like the #WorldCup is a #ColdWar relic we shouldn't expect to see anytime soon.  https://t.co/7tDspxRobU  https://t.co/abOz0UxOGV",en,"['skripal', 'russia', 'sports', 'worldcup', 'coldwar']",[],28350927,28350927,Stratfor,Stratfor - a RANE Company,1,10,https://twitter.com/Stratfor/status/978323338794856448,['http://ow.ly/4c2Q30j9NNn'],['https://pbs.twimg.com/media/DZOz46oWAAA53Bn.jpg'],1,https://pbs.twimg.com/media/DZOz46oWAAA53Bn.jpg,False,4,0,2,,worldcup OR worldcup2018,,,,,,,[],,,,
23,978277963253862400,978277963253862400,1522074616000.0,2018-03-26 07:30:16,-0800,,"In this week's #GeopoliticsOfSports column, contributor @ozyurtcu discusses the United Kingdom’s threat to boycott the #WorldCup following the poisoning of a former Russian military officer.  https://t.co/GmisvEvHx7  https://t.co/sFxFBCKrRE",en,"['geopoliticsofsports', 'worldcup']",[],28350927,28350927,Stratfor,Stratfor - a RANE Company,1,07,https://twitter.com/Stratfor/status/978277963253862400,['http://ow.ly/YI0830j9NAP'],['https://pbs.twimg.com/media/DZOKnpvUMAI2gya.jpg'],1,https://pbs.twimg.com/media/DZOKnpvUMAI2gya.jpg,False,6,0,3,,worldcup OR worldcup2018,,,,,,,[],,,,
24,879356100398731266,879356100398731266,1498489806000.0,2017-06-26 08:10:06,-0800,,It's the geopolitics of sports play-by-play: A #WorldCup prep test and the dawn of #Olympic skateboarding.  https://t.co/urrxpUpYyq  https://t.co/fKsLaK0pqJ,en,"['worldcup', 'olympic']",[],28350927,28350927,Stratfor,Stratfor - a RANE Company,1,08,https://twitter.com/Stratfor/status/879356100398731266,['http://social.stratfor.com/LWoD30cTJAK'],['https://pbs.twimg.com/media/DDQZtWUXYAA3xm1.jpg'],1,https://pbs.twimg.com/media/DDQZtWUXYAA3xm1.jpg,False,7,0,4,,worldcup OR worldcup2018,,,,,,,[],,,,
